{
  "$schema": "https://json-schema.org/draft/2020-12/schema",
  "$id": "https://github.com/hiroshitanaka-creator/Po_core_-Original-design/blob/main/schemas/semantic_jump_human_review_request_v1.schema.json",
  "title": "Po_core semantic_jump_human_review_request v1",
  "description": "PR-018 design + runtime contract (seed-level). Converts a SemanticFrameProposal (PR-017) into a human-reviewable review REQUEST -- it never executes a semantic jump. semantic_frame_changed, content_rewrite_applied, state_mutation_applied, safety_bypass_applied, trace_reset_applied, and semantic_jump_executed are all const false: this is human-review-gate only (read / verify / request_review / trace / validate). See docs/contracts/SEMANTIC_JUMP_HUMAN_REVIEW_GATE_V1.md.",
  "type": "object",
  "additionalProperties": false,
  "required": [
    "schema_version",
    "review_request_id",
    "request_id",
    "semantic_frame_proposal_id",
    "semantic_jump_plan_id",
    "semantic_jump_tensor_id",
    "source_step_ids",
    "review_status",
    "review_reason",
    "review_required",
    "execution_mode",
    "semantic_frame_changed",
    "content_rewrite_applied",
    "state_mutation_applied",
    "safety_bypass_applied",
    "trace_reset_applied",
    "semantic_jump_executed",
    "original_semantic_step_hashes",
    "original_semantic_profile_refs",
    "source_trace_refs",
    "review_payload",
    "safety_constraints",
    "created_at",
    "trace_refs"
  ],
  "properties": {
    "schema_version": { "const": "semantic_jump_human_review_request_v1" },
    "review_request_id": { "type": "string", "minLength": 1 },
    "request_id": { "type": "string", "minLength": 1 },
    "semantic_frame_proposal_id": {
      "type": "string",
      "minLength": 1,
      "description": "The semantic_frame_proposal (PR-017) this review request was generated from."
    },
    "semantic_jump_plan_id": {
      "type": "string",
      "minLength": 1,
      "description": "Copied from semantic_frame_proposal.semantic_jump_plan_id."
    },
    "semantic_jump_tensor_id": {
      "type": "string",
      "minLength": 1,
      "description": "Copied from semantic_frame_proposal.semantic_jump_tensor_id."
    },
    "source_step_ids": {
      "type": "array",
      "minItems": 1,
      "items": { "type": "string", "minLength": 1 }
    },
    "review_status": {
      "type": "string",
      "enum": ["required", "pending", "decision_recorded", "not_applicable"],
      "description": "PR-018 seed runtime only ever produces 'required' when a review request is generated by SemanticJumpHumanReviewGate.require_review()."
    },
    "review_reason": { "type": "string", "minLength": 1 },
    "review_required": {
      "const": true,
      "description": "Every review request requires human review before any future jump execution. Always true."
    },
    "execution_mode": {
      "const": "human_review_gate_only",
      "description": "Fixed mode marker: this gate only ever requests and records human review, never executes anything."
    },
    "semantic_frame_changed": {
      "const": false,
      "description": "This PR never changes the semantic frame. Always false."
    },
    "content_rewrite_applied": {
      "const": false,
      "description": "This request never rewrites content. Always false."
    },
    "state_mutation_applied": {
      "const": false,
      "description": "This request never mutates runtime state. Always false."
    },
    "safety_bypass_applied": {
      "const": false,
      "description": "This request never bypasses a safety gate. Always false."
    },
    "trace_reset_applied": {
      "const": false,
      "description": "This request never resets or deletes trace. Always false."
    },
    "semantic_jump_executed": {
      "const": false,
      "description": "This PR never executes a semantic jump, even if a later decision is approved. Always false."
    },
    "original_semantic_step_hashes": {
      "type": "object",
      "description": "Inherited verbatim from semantic_frame_proposal.original_semantic_step_hashes. Key: step_id. Value: SHA-256 hex digest.",
      "additionalProperties": { "type": "string", "pattern": "^[a-f0-9]{64}$" }
    },
    "original_semantic_profile_refs": {
      "type": "array",
      "items": { "type": "string", "minLength": 1 },
      "description": "Inherited verbatim from semantic_frame_proposal.original_semantic_profile_refs."
    },
    "source_trace_refs": {
      "type": "array",
      "minItems": 1,
      "items": { "type": "string", "minLength": 1 },
      "description": "Must include a SemanticJumpFrameProposed (or SemanticJumpPlanned) event id, directly or via ancestry."
    },
    "review_payload": {
      "type": "object",
      "additionalProperties": false,
      "required": [
        "proposal_summary",
        "frame_shift_type",
        "jump_pressure",
        "risk_summary",
        "review_questions"
      ],
      "properties": {
        "proposal_summary": { "type": "string", "minLength": 1 },
        "frame_shift_type": {
          "type": "string",
          "enum": [
            "none",
            "reframing",
            "context_shift",
            "responsibility_shift",
            "ethical_frame_shift",
            "blocked_trace_reactivation",
            "unresolved_contradiction_jump"
          ]
        },
        "jump_pressure": { "type": "number", "minimum": 0.0, "maximum": 1.0 },
        "risk_summary": { "type": "string", "minLength": 1 },
        "review_questions": {
          "type": "array",
          "minItems": 1,
          "items": { "type": "string", "minLength": 1 }
        }
      }
    },
    "safety_constraints": {
      "type": "object",
      "additionalProperties": false,
      "required": [
        "requires_trace_continuity",
        "requires_human_review_for_execution",
        "requires_future_executor",
        "forbids_content_rewrite",
        "forbids_state_mutation",
        "forbids_safety_bypass",
        "forbids_trace_reset",
        "forbids_auto_execution_after_approval"
      ],
      "properties": {
        "requires_trace_continuity": { "const": true },
        "requires_human_review_for_execution": { "const": true },
        "requires_future_executor": { "const": true },
        "forbids_content_rewrite": { "const": true },
        "forbids_state_mutation": { "const": true },
        "forbids_safety_bypass": { "const": true },
        "forbids_trace_reset": { "const": true },
        "forbids_auto_execution_after_approval": { "const": true }
      },
      "description": "PR-018 seed runtime always sets every field true."
    },
    "created_at": { "type": "string", "format": "date-time" },
    "trace_refs": {
      "type": "array",
      "minItems": 1,
      "items": { "type": "string", "minLength": 1 },
      "description": "Must resolve to a SemanticJumpFrameProposed event, directly or via ancestry -- enforced by TraceContinuityValidator, not expressible in JSON Schema."
    }
  }
}
